ID,Codigo_MEN,Cualificacion,Nivel_MNC,Titulo_Otorga,Sector,Area_Cualificacion,Sigla_Area
183,4-TRAL-TRA-008,Asistencia a maniobras de embarcaciones fluviales mayores,4,,Trasnporte Fluvial,Logística y Transporte,LOTR
184,4-TRAL-TRA-009,Operación de embarcaciones fluviales menores,4,,Trasnporte Fluvial,Logística y Transporte,LOTR
185,5- TRAL-TRA-014,Gobierno de embarcaciones fluviales mayores,5,,Trasnporte Fluvial,Logística y Transporte,LOTR
186,5-TRAL-LOG-003,Gestión de Operaciones Logísticas,5,,Logística empresarial,Logística y Transporte,LOTR
187,5-TRAL-TRA-009,Gestión de monitoreo de flotas y redes de transporte terrestre,5,,Transporte terrestre,Logística y Transporte,LOTR
188,5-TRAL-TRA-010,Operación con restricciones en sección de cubierta y navegación de transporte marítimo comercial,5,,Transporte marítimo,Logística y Transporte,LOTR
189,5-TRAL-TRA-011,Operación con restricciones en sección de máquinas de transporte marítimo comercial,5,,Transporte marítimo,Logística y Transporte,LOTR
190,5-TRAL-TRA-012,Gestión con restricciones en sección de cubierta y navegación de transporte marítimo comercial,5,,Transporte marítimo,Logística y Transporte,LOTR
191,5-TRAL-TRA-013,Gestión con restricciones en sección de máquinas de transporte marítimo comercial,5,,Transporte marítimo,Logística y Transporte,LOTR
192,6- TRAL-TRA-020,Gestión de las operaciones del transporte acuático,6,,Trasnporte Fluvial,Logística y Transporte,LOTR
193,6- TRAL-TRA-021,Asistencia en practicaje de maniobras náuticas de embarcaciones mayores en zona portuaria,6,,Trasnporte Fluvial,Logística y Transporte,LOTR
194,6-LP-TL -001,Gestión de operaciones portuarias,6,,Logistica Portuaria,Logística y Transporte,LOTR
195,6-LP-TL-006,Asistencia en practicaje de maniobras con remolcadores a la nave,6,,Logistica Portuaria,Logística y Transporte,LOTR
196,6-TRAL-LOG-004,Administración logística,6,,Logística empresarial,Logística y Transporte,LOTR
197,6-TRAL-LOG-005,Dirección de logística integral,6,,Logística empresarial,Logística y Transporte,LOTR
198,6-TRAL-TRA-016,Operación sin restricciones en sección de cubierta y navegación de transporte marítimo comercial,6,,Transporte marítimo,Logística y Transporte,LOTR
199,6-TRAL-TRA-017,Operación sin restricciones en sección de máquinas de transporte marítimo comercial,6,,Transporte marítimo,Logística y Transporte,LOTR
200,6-TRAL-TRA-018,Gestión sin restricciones en sección de cubierta y navegación de transporte marítimo comercial,6,,Transporte marítimo,Logística y Transporte,LOTR
201,6-TRAL-TRA-019,Gestión sin restricciones en sección de máquinas de transporte marítimo comercial,6,,Transporte marítimo,Logística y Transporte,LOTR
202,7-TRAL-LOG-006,Gerencia de la Cadena de Suministro,7,,Logística empresarial,Logística y Transporte,LOTR
203,4-LOTR-AER–DMA-001 ,Ensamble de Aeronaves y Partes,4,,Aeronáutico,Logística y Transporte,LOTR
204,4-LOTR-AER-SEA-003,Atención al Riesgo Aeroportuario,4,,Aeronáutico,Logística y Transporte,LOTR
205,5-LOTR-AER-DMA-004,Gestión de manufactura de aeronaves y partes,5,,Aeronáutico,Logística y Transporte,LOTR
206,5-LOTR-AER-MNT-002,Mantenimiento Aeronáutico,5,,Aeronáutico,Logística y Transporte,LOTR
207,5-LOTR-AER-OPA-005 ,Gestión de Servicio a Pasajeros,5,,Aeronáutico,Logística y Transporte,LOTR
208,5-LOTR-AER-OPA-006,Operación de Aeronaves ,5,,Aeronáutico,Logística y Transporte,LOTR
209,5-LOTR-AER-SAN-007,Control de Tránsito Aéreo,5,,Aeronáutico,Logística y Transporte,LOTR
210,5-LOTR-AER-SAN-008,Gestión Información Aérea Clima y Atmósfera,5,,Aeronáutico,Logística y Transporte,LOTR
211,5-LOTR-AER-SEA-009 ,Gestión de Operación Aeroportuaria,5,,Aeronáutico,Logística y Transporte,LOTR
212,6-LOTR-AER-DMA-010,Ingeniería Aeronáutica,6,,Aeronáutico,Logística y Transporte,LOTR
213,6-LOTR-AER-IYC-011,Administración de la Seguridad Aeronáutica,6,,Aeronáutico,Logística y Transporte,LOTR
214,6-LOTR-AER-SAN-012,Estudio del Clima y Atmósfera en Aviación,6,,Aeronáutico,Logística y Transporte,LOTR
215,6-LOTR-AER-SEC-013,Gestión de la Seguridad de la Aviación Civil,6,,Aeronáutico,Logística y Transporte,LOTR
216,7-LOTR-AER-SEA-014,Gerencia Aeroportuaria.,7,,Aeronáutico,Logística y Transporte,LOTR
217,4-INCO-MDC-001,"Operación de equipos, dispositivos y herramientas para contenidos digitales",4,,Contenido Digitales,Tecnologías de la información y las comunicaciones,TICO
218,5-INCO-MDC-002,Asistencia en producción de piezas gráficas digitales para contenidos multiplataforma,5,,Contenido Digitales,Tecnologías de la información y las comunicaciones,TICO
219,5-INCO-MDC-003,Producción de contenidos digitales,5,,Contenido Digitales,Tecnologías de la información y las comunicaciones,TICO
220,6-INCO-MDC-004,Creación de contenidos digitales,6,,Contenido Digitales,Tecnologías de la información y las comunicaciones,TICO
221,6-INCO-MDC-005,Animación digital,6,,Contenido Digitales,Tecnologías de la información y las comunicaciones,TICO
222,6-INCO-MDC-006,Posproducción de contenidos digitales,6,,Contenido Digitales,Tecnologías de la información y las comunicaciones,TICO
223,6-INCO-MDC-007,Gestión de contenidos digitales,6,,Contenido Digitales,Tecnologías de la información y las comunicaciones,TICO
224,7-INCO-MDC-008,Innovación en creación de contenidos digitales,7,,Contenido Digitales,Tecnologías de la información y las comunicaciones,TICO
225,4-INCO-SWE-001,Manejo de herramientas para codificación de software,4,,Software,Tecnologías de la información y las comunicaciones,TICO
226,5-INCO-SWE-002,Programación de software.,5,,Software,Tecnologías de la información y las comunicaciones,TICO
227,5-INCO-SWE-003,Desarrollo de Software.,5,,Software,Tecnologías de la información y las comunicaciones,TICO
228,5-INCO-SWE-004,Implementación de Aplicaciones de Software,5,,Software,Tecnologías de la información y las comunicaciones,TICO
229,5-INCO-SWE-005,Soluciones de Software Web,5,,Software,Tecnologías de la información y las comunicaciones,TICO
230,6-INCO-SW-011,Creación de Videojuegos.,6,,Software,Tecnologías de la información y las comunicaciones,TICO
231,6-INCO-SW-012,Aplicación de Videojuegos en Contextos Lúdicos y no Lúdicos,6,,Software,Tecnologías de la información y las comunicaciones,TICO
232,6-INCO-SWE-006,Construcción de Sistemas de Software,6,,Software,Tecnologías de la información y las comunicaciones,TICO
233,6-INCO-SWE-007,Integración de software,6,,Software,Tecnologías de la información y las comunicaciones,TICO
234,6-INCO-SWE-008,Gestión de Sistemas de Software,6,,Software,Tecnologías de la información y las comunicaciones,TICO
235,6-INCO-SWE-009,Diseño Arquitectónico de Sistemas de Software,6,,Software,Tecnologías de la información y las comunicaciones,TICO
236,6-INCO-SWE-010,Aseguramiento de la Calidad de Sistemas de Software,6,,Software,Tecnologías de la información y las comunicaciones,TICO
237,7-INCO-SWE-013,Generación de sistemas de software con inteligencia artificial.,7,,Software,Tecnologías de la información y las comunicaciones,TICO
238,7-INCO-SWE-014,Construcción de Plataformas de Software,7,,Software,Tecnologías de la información y las comunicaciones,TICO
239,7-INCO-SWE-015,Innovación en Arquitecturas y Servicios de Software,7,,Software,Tecnologías de la información y las comunicaciones,TICO
240,4-INCO-ITS-001,Instalación y soporte de redes de cableado estructurado,4,,Tecnologías de la Información,Tecnologías de la información y las comunicaciones,TICO
241,4-INCO-ITS-002,Instalación y mantenimiento de computadores y periféricos,4,,Tecnologías de la Información,Tecnologías de la información y las comunicaciones,TICO
242,5-INCO-ITS-003,Administración de redes multiservicio e infraestructuras TI,5,,Tecnologías de la Información,Tecnologías de la información y las comunicaciones,TICO
243,5-INCO-ITS-011,Operación y mantenimiento de bases de datos,5,,Tecnologías de la Información,Tecnologías de la información y las comunicaciones,TICO
244,5-INCO-ITS-012,Gestión de bases de datos,5,,Tecnologías de la Información,Tecnologías de la información y las comunicaciones,TICO
245,5-INCO-ITS-013,Aplicación de herramientas y técnicas para bases de datos,5,,Tecnologías de la Información,Tecnologías de la información y las comunicaciones,TICO
246,6-INCO-ITS-004,"Diseño, implementación y administración de redes informáticas multiservicio",6,,Tecnologías de la Información,Tecnologías de la información y las comunicaciones,TICO
247,6-INCO-ITS-005,Modernización en modelos tecnológicos para las soluciones blockchain y DLT,6,,Tecnologías de la Información,Tecnologías de la información y las comunicaciones,TICO
248,6-INCO-ITS-006,Gestión de soluciones cloud computing,6,,Tecnologías de la Información,Tecnologías de la información y las comunicaciones,TICO
249,6-INCO-ITS-007,Diseño de Infraestructura de Tecnologías de la Información,6,,Tecnologías de la Información,Tecnologías de la información y las comunicaciones,TICO
250,6-INCO-ITS-008,Gestión de la seguridad de la información,6,,Tecnologías de la Información,Tecnologías de la información y las comunicaciones,TICO
251,6-INCO-ITS-014,Administración de datos e información.,6,,Tecnologías de la Información,Tecnologías de la información y las comunicaciones,TICO
252,6-INCO-ITS-015,Escalabilidad de datos e información.,6,,Tecnologías de la Información,Tecnologías de la información y las comunicaciones,TICO
253,6-INCO-ITS-016,Analítica de datos e información.,6,,Tecnologías de la Información,Tecnologías de la información y las comunicaciones,TICO
254,6-INCO-ITS-017,Diseño de arquitecturas para datos e información,6,,Tecnologías de la Información,Tecnologías de la información y las comunicaciones,TICO
255,7-INCO-ITS-009,Innovación en soluciones de empresas y gobierno soportados en tecnología Blockchain y DLT.,7,,Tecnologías de la Información,Tecnologías de la información y las comunicaciones,TICO
256,7-INCO-ITS-010,Diseño y desarrollo de soluciones de ciberseguridad,7,,Tecnologías de la Información,Tecnologías de la información y las comunicaciones,TICO
257,7-INCO-ITS-018,Gestión de ciencia de datos e información.,7,,Tecnologías de la Información,Tecnologías de la información y las comunicaciones,TICO
258,7-INCO-ITS-019,Gobierno de datos e información.,7,,Tecnologías de la Información,Tecnologías de la información y las comunicaciones,TICO
259,4-INCO-TLC-001,Instalación y mantenimiento de redes de telecomunicaciones.,4,,Telecomunicaciones,Tecnologías de la información y las comunicaciones,TICO
260,4-INCO-TLC-002,Operación de redes de comunicaciones inalámbricas.,4,,Telecomunicaciones,Tecnologías de la información y las comunicaciones,TICO
261,5-INCO-TLC-003,Ejecución de operaciones técnicas en sistemas de telecomunicaciones,5,,Telecomunicaciones,Tecnologías de la información y las comunicaciones,TICO
262,6-INCO-TLC-004,Diseño e implementación de sistemas de telecomunicaciones.,6,,Telecomunicaciones,Tecnologías de la información y las comunicaciones,TICO
263,6-INCO-TLC-005,Innovación de Sistemas de Transmisión.,6,,Telecomunicaciones,Tecnologías de la información y las comunicaciones,TICO
264,6-INCO-TLC-006,Desarrollo de soluciones tecnológicas en Comunicaciones Móviles,6,,Telecomunicaciones,Tecnologías de la información y las comunicaciones,TICO
265,6-INCO-TLC-007,"Gestión de infraestructura, plataforma y aplicaciones IdC",6,,Telecomunicaciones,Tecnologías de la información y las comunicaciones,TICO
266,7-INCO-TLC-008,Transformación digital de Sistemas de transmisión y comunicaciones móviles,7,,Telecomunicaciones,Tecnologías de la información y las comunicaciones,TICO
267,2-TCCD-TRV-001,Operaciones básicas de la industria manufacturera de moda,2,,"Moda, textil, cueros y pieles","Textil, Confección Y Diseño De Modas",TCDM
268,3 -TCCD-TXT-003,Fabricación de productos de pasamanería textiles y artículos de piel y cuero,3,,"Moda, textil, cueros y pieles","Textil, Confección Y Diseño De Modas",TCDM
269,3-CCD-TXT-002,Manejo máquina tejedoras,3,,"Moda, textil, cueros y pieles","Textil, Confección Y Diseño De Modas",TCDM
270,3-TCCD- CNF–001,Fabricación  de prendas de vestir,3,,"Moda, textil, cueros y pieles","Textil, Confección Y Diseño De Modas",TCDM
271,3-TCCD-CMC-001,Operación  de máquinas de calzado y marroquinería,3,,"Moda, textil, cueros y pieles","Textil, Confección Y Diseño De Modas",TCDM
272,3-TCCD-CMC–002,Tratamiento integral de  pieles y cueros,3,,"Moda, textil, cueros y pieles","Textil, Confección Y Diseño De Modas",TCDM
273,3-TCCD-CMC–003,Armado de artículos de calzado y marroquinería,3,,"Moda, textil, cueros y pieles","Textil, Confección Y Diseño De Modas",TCDM
274,3-TCCD-TRV-002,Servicios  de lavandería,3,,"Moda, textil, cueros y pieles","Textil, Confección Y Diseño De Modas",TCDM
275,3-TCCD-TXT-001,"Operación de máquinas de blanqueamiento, teñido y limpieza de tejidos",3,,"Moda, textil, cueros y pieles","Textil, Confección Y Diseño De Modas",TCDM
276,3-TCCD-TXT-002,Manejo de máquinas tejedoras.pdf,3,,"Moda, textil, cueros y pieles","Textil, Confección Y Diseño De Modas",TCDM
277,3-TCCD-TXT-003, Fabricación de productos de pasamanería textiles y artículos de piel y cuero,3,,"Moda, textil, cueros y pieles","Textil, Confección Y Diseño De Modas",TCDM
278,3-TCCD-TXT-004,"Preparación de fibras, hilado y devanado.",3,,"Moda, textil, cueros y pieles","Textil, Confección Y Diseño De Modas",TCDM
279,4-TCCD-CMC-004,Manejo de procesos de curtiembre.,4,,"Moda, textil, cueros y pieles","Textil, Confección Y Diseño De Modas",TCDM
280,4-TCCD-CNF-002,Confección y reparación de tapizados en las líneas de muebles y colchones,4,,"Moda, textil, cueros y pieles","Textil, Confección Y Diseño De Modas",TCDM
281,4-TCCD-TRV–003,"Patronaje y Corte de piezas,  prendas de vestir y marroquinería",4,,"Moda, textil, cueros y pieles","Textil, Confección Y Diseño De Modas",TCDM
282,4-TCCD-TRV-004,"Clasificación, inspección y análisis de producto textil, cuero, confección y diseño.pdf",4,,"Moda, textil, cueros y pieles","Textil, Confección Y Diseño De Modas",TCDM
283,4-TCCD-TXT 005,Tejeduría de prendas y productos de punto.pdf,4,,"Moda, textil, cueros y pieles","Textil, Confección Y Diseño De Modas",TCDM
284,4-TCCD-TXT 006, Procesos de tejeduría de prendas y accesorios.pdf,4,,"Moda, textil, cueros y pieles","Textil, Confección Y Diseño De Modas",TCDM
285,4-TCCD-TXT- 007,Preparación y proceso de tejido plano,4,,"Moda, textil, cueros y pieles","Textil, Confección Y Diseño De Modas",TCDM
286,5-TCCD- CNF–003,Elaboración de prendas de vestir.,5,,"Moda, textil, cueros y pieles","Textil, Confección Y Diseño De Modas",TCDM
287,5-TCCD-CMC-005,Producción de calzado y Marroquinería,5,,"Moda, textil, cueros y pieles","Textil, Confección Y Diseño De Modas",TCDM
288,5-TCCD-TRV-005,"Sistemas de producción textil, cuero y confección",5,,"Moda, textil, cueros y pieles","Textil, Confección Y Diseño De Modas",TCDM
289,5-TCCD-TRV-006,"Supervisión de manufactura textil, del  cuero y la confeccion",5,,"Moda, textil, cueros y pieles","Textil, Confección Y Diseño De Modas",TCDM
290,6-TCCD-DSG-001,Diseño de prendas y accesorios de vestir,6,,"Moda, textil, cueros y pieles","Textil, Confección Y Diseño De Modas",TCDM
291,6-TCCD-TRV-007,"Ingeniería de producción textil, cuero, confección y diseño de moda",6,,"Moda, textil, cueros y pieles","Textil, Confección Y Diseño De Modas",TCDM
292,6-TCCD-TRV-008,"Dirección de producción textil, cuero, confección y diseño de moda",6,,"Moda, textil, cueros y pieles","Textil, Confección Y Diseño De Modas",TCDM
293,3-TUHG-A&B-001,Asistencia en el servicio de alimentos y bebidas,3,,Alimentos y bebidas,"Turismo, Hotelería y Gastronomía",TUHG
294,3-TUHG-A&B-002,Servicio de alimentos y Bebidas,3,,Alimentos y bebidas,"Turismo, Hotelería y Gastronomía",TUHG
295,3-TUHG-A&B-003,Parrilla y Cocina,3,,Alimentos y bebidas,"Turismo, Hotelería y Gastronomía",TUHG
296,4-TUHG-A&B-004,Preparación de alimentos,4,,Alimentos y bebidas,"Turismo, Hotelería y Gastronomía",TUHG
297,4-TUHG-A&B-005,Preparación y servicio de bebidas alcohólicas y no alcohólicas,4,,Alimentos y bebidas,"Turismo, Hotelería y Gastronomía",TUHG
298,4-TUHG-A&B-006,Preparación y servicio de cafés especializados,4,,Alimentos y bebidas,"Turismo, Hotelería y Gastronomía",TUHG
299,5-TUHG-A&B-007,Dirección y control de la operación de la cocina,5,,Alimentos y bebidas,"Turismo, Hotelería y Gastronomía",TUHG
300,6-TUHG-A&B-008,Gastronomía,6,,Alimentos y bebidas,"Turismo, Hotelería y Gastronomía",TUHG
301,3-TUHG-GUI-001,Facilitación de información y promoción turística,3,,Guianza Turística,"Turismo, Hotelería y Gastronomía",TUHG
302,4-TUHG-GUI-002,Acompañamiento local a visitantes en el ámbito geográfico local,4,,Guianza Turística,"Turismo, Hotelería y Gastronomía",TUHG
303,5-TUHG-GUI-003,Guionaje turístico ,5,,Guianza Turística,"Turismo, Hotelería y Gastronomía",TUHG
304,5-TUHG-GUI-004,Guionaje en observación de aves,5,,Guianza Turística,"Turismo, Hotelería y Gastronomía",TUHG
305,5-TUHG-GUI-005,Diseño y conducción de recorridos por la naturaleza ,5,,Guianza Turística,"Turismo, Hotelería y Gastronomía",TUHG
306,5-TUHG-GUI-006,Interpretación del patrimonio natural y cultura,5,,Guianza Turística,"Turismo, Hotelería y Gastronomía",TUHG
307,2-TUHG-HOT-002,Mantenimiento de habitaciones y áreas públicas en hoteles y establecimientos de alojamiento,2,,Hotelería,"Turismo, Hotelería y Gastronomía",TUHG
308,4-TUHG-HOT-003,Reservas y asistencia de servicios turísticos,4,,Hotelería,"Turismo, Hotelería y Gastronomía",TUHG
309,5-TUHG-HOT-004,Coordinación y supervisión de servicios hoteleros,5,,Hotelería,"Turismo, Hotelería y Gastronomía",TUHG
310,5-TUHG-TVS-001,Coordinación de eventos,5,,Transversal Turismo,"Turismo, Hotelería y Gastronomía",TUHG
311,6-TUHG-TVS-002,Gerencia hotelera y turística,6,,Transversal Turismo,"Turismo, Hotelería y Gastronomía",TUHG
312,6-TUHG-TVS-003,Planificación y Organización de eventos MICE,6,,Transversal Turismo,"Turismo, Hotelería y Gastronomía",TUHG
313,2-TUHG-HOT-001,"Asistencia en servicios al cliente, huésped y pasajero",2,,Hotelería,"Turismo, Hotelería y Gastronomía",TUHG
314,4-TUHG-TUR-001,Organización y comercialización productos y servicios turísticos,4,,Turismo,"Turismo, Hotelería y Gastronomía",TUHG
315,4-TUHG-TUR-002,Atención de servicios  a pasajeros en aeropuerto,4,,Turismo,"Turismo, Hotelería y Gastronomía",TUHG
316,5-TUHG-TUR-003,Estructuración y Operación de Productos y Servicios Turísticos,5,,Turismo,"Turismo, Hotelería y Gastronomía",TUHG
317,5-TUHG-TUR-004,Diseño y coordinación de viajes y turismo,5,,Turismo,"Turismo, Hotelería y Gastronomía",TUHG
318,5-TUHG-TUR-005,Gestión de productos y servicios turísticos especializados ,5,,Turismo,"Turismo, Hotelería y Gastronomía",TUHG
319,6-TUHG-TUR-006,Planificación turística,6,,Turismo,"Turismo, Hotelería y Gastronomía",TUHG
320,7-TUHG-TUR-007,Gestión de Proyectos Territoriales y Consultoría de Turismo,7,,Turismo,"Turismo, Hotelería y Gastronomía",TUHG
321,4-CPSA-CPA-31410-E-001,Asistencia en bioprocesos en uso sostenible de recursos naturales.,4,,Conservación y Protección Ambiental,"Conservación, Protección y Saneamiento Ambiental –",
322,5-CPSA-CPA-31431-E-002,Aprovechamiento sostenible de recursos naturales.,5,,Conservación y Protección Ambiental,"Conservación, Protección y Saneamiento Ambiental –",
323,5-CPSA-CPA-31431-E-003,Gestión de procesos de aprovechamiento de recursos naturales en proyectos de conservación ambiental.,5,,Conservación y Protección Ambiental,"Conservación, Protección y Saneamiento Ambiental –",
324,5-CPSA-CPA-31410-E-004,Gestión de planes de manejo de biodiversidad urbana.,5,,Conservación y Protección Ambiental,"Conservación, Protección y Saneamiento Ambiental –",
325,6-CPSA-CPA-21331-E-005,Conservación y protección ambiental.,6,,Conservación y Protección Ambiental,"Conservación, Protección y Saneamiento Ambiental –",
326,6-CPSA-CPA-21331-E-006,Diseño y desarrollo de indicadores de sostenibilidad ambiental.,6,,Conservación y Protección Ambiental,"Conservación, Protección y Saneamiento Ambiental –",
327,7-CPSA-CPA-21331-E-007,Conservación y protección de recursos acuáticos continentales y marino costeros.,7,,Conservación y Protección Ambiental,"Conservación, Protección y Saneamiento Ambiental –",
328,7-CPSA-CPA-21331-E-008,"Sostenibilidad de bosques, biodiversidad y servicios ecosistémicos.",7,,Conservación y Protección Ambiental,"Conservación, Protección y Saneamiento Ambiental –",
329,2-CPSA-CPA-75440--E-001,Control de vectores y plagas en saneamiento ambiental.,2,,Gestión y Saneamiento Ambiental,"Conservación, Protección y Saneamiento Ambiental –",
330,2-CPSA-CPA-96120--E-002,Clasificación y manejo de residuos.,2,,Gestión y Saneamiento Ambiental,"Conservación, Protección y Saneamiento Ambiental –",
331,3-CPSA-GSA-31321-E-003,Operación de instalaciones de tratamiento de agua potable y residuales.,3,,Gestión y Saneamiento Ambiental,"Conservación, Protección y Saneamiento Ambiental –",
332,3-CPSA-GSA-31322-E-004,Operación de sistemas de rellenos sanitarios y sistemas de incineración.,3,,Gestión y Saneamiento Ambiental,"Conservación, Protección y Saneamiento Ambiental –",
333,3-CPSA-GSA-31322-E-005,"Operación de plantas de aprovechamiento y disposición final de residuos peligrosos, especiales y de manejo diferenciado.",3,,Gestión y Saneamiento Ambiental,"Conservación, Protección y Saneamiento Ambiental –",
334,4-CPSA-GSA-32574-E-006,Asistencia en saneamiento ambiental.,4,,Gestión y Saneamiento Ambiental,"Conservación, Protección y Saneamiento Ambiental –",
335,4-CPSA-GSA-32573-E-007,Manejo de vertimientos y derrames de residuos peligrosos.,4,,Gestión y Saneamiento Ambiental,"Conservación, Protección y Saneamiento Ambiental –",
336,5-CPSA-GSA-32573-E-008,Supervisión de procesos de biorremediación y remediación ambiental.,5,,Gestión y Saneamiento Ambiental,"Conservación, Protección y Saneamiento Ambiental –",
337,5-CPSA-GSA-31321-E-009,Supervisión de plantas de tratamiento de aguas y de gestión integral de residuos.,5,,Gestión y Saneamiento Ambiental,"Conservación, Protección y Saneamiento Ambiental –",
338,5-CPSA-GSA-32572-E-010,Coordinación e inspección de sistemas integrados de gestión,5,,Gestión y Saneamiento Ambiental,"Conservación, Protección y Saneamiento Ambiental –",
339,6-CPSA-GSA-21430-E-011,Ingeniería ambiental y de procesos de saneamiento ambiental.,6,,Gestión y Saneamiento Ambiental,"Conservación, Protección y Saneamiento Ambiental –",
340,6-CPSA-GSA-21430-E-012,Gestión del riesgo ambiental.,6,,Gestión y Saneamiento Ambiental,"Conservación, Protección y Saneamiento Ambiental –",
341,6-CPSA-GSA-21430-E-013,Gestión integral de residuos.,6,,Gestión y Saneamiento Ambiental,"Conservación, Protección y Saneamiento Ambiental –",
342,6-CPSA-GSA-21430-E-014,Gestión de proyectos en fijación de carbono y cambio climático.,6,,Gestión y Saneamiento Ambiental,"Conservación, Protección y Saneamiento Ambiental –",
343,7-CPSA-GSA-21430-E-015,Calidad ambiental y cambio climático.,7,,Gestión y Saneamiento Ambiental,"Conservación, Protección y Saneamiento Ambiental –",
344,5-CPSA-TRV-32573-E-001,"Desarrollo de soluciones de base tecnológica aplicadas a conservación, protección y saneamiento ambiental.",5,,Transversales,"Conservación, Protección y Saneamiento Ambiental –",
345,6-CPSA-TRV-21430-E-002,Gestión de herramientas geomáticas aplicadas al medio ambiente.,6,,Transversales,"Conservación, Protección y Saneamiento Ambiental –",
346,6-CPSA-TRV-21331-E-003,Gestión de procesos de participación y educación ambiental,6,,Transversales,"Conservación, Protección y Saneamiento Ambiental –",
347,6-CPSA-TRV-21331-E-004,Gestión de proyectos de sostenibilidad y saneamiento ambiental.,6,,Transversales,"Conservación, Protección y Saneamiento Ambiental –",
348,7-CPSA-TRV-21331-E-005,Innovación en bioeconomía y negocios verdes.,7,,Transversales,"Conservación, Protección y Saneamiento Ambiental –",
349,7-CPSA-TRV-21430-E-006,Innovación en saneamiento ambiental.,7,,Transversales,"Conservación, Protección y Saneamiento Ambiental –",
350,7-CPSA-TRV-12199-E-007,Dirección estratégica de ambiente y sostenibilidad.,7,,Transversales,"Conservación, Protección y Saneamiento Ambiental –",
351,,Actividad física con soporte musical.,4,,Actividad física,"Actividades físicas, deportivas y recreativas",
352,,"Coordinación de servicios de actividades físicas, deportivas y recreativas.",5,,Actividad física,"Actividades físicas, deportivas y recreativas",
353,,Instructor de actividad física.,6,,Actividad física,"Actividades físicas, deportivas y recreativas",
354,,"Gestion Integral de instalaciones y espacios para las actividades físicas, deportivas y recreativas.",6,,Actividad física,"Actividades físicas, deportivas y recreativas",
355,,"Gamificación y lúdica aplicada a las actividades físicas, deportivas y recreativas.",6,,Actividad física,"Actividades físicas, deportivas y recreativas",
356,,Diseño y desarrollo de actividad física adaptada y recreación inclusiva.,6,,Actividad física,"Actividades físicas, deportivas y recreativas",
357,,"Innovación tecnológica aplicada a las actividades  físicas, deportivas y recreativas.",7,,Actividad física,"Actividades físicas, deportivas y recreativas",
358,,Deportista,4,,Deporte,"Actividades físicas, deportivas y recreativas",
