ID,Codigo_MEN,Cualificacion,Nivel_MNC,Titulo_Otorga,Sector,Area_Cualificacion,Sigla_Area
359,,Preparador físico,4,,Deporte,"Actividades físicas, deportivas y recreativas",
360,,"Auxiliar de servicios de actividad física, recreación y deporte",4,,Deporte,"Actividades físicas, deportivas y recreativas",
361,,"Coordinador de servicios de actividades físicas, deportivas y recreativas",5,,Deporte,"Actividades físicas, deportivas y recreativas",
362,,Entrenamiento deportivo,6,,Deporte,"Actividades físicas, deportivas y recreativas",
363,,Entrenamiento en deporte adaptado y deporte paralímpico,6,,Deporte,"Actividades físicas, deportivas y recreativas",
364,,"Gestión integral de instalaciones y espacios para las actividades físicas, deportivas y recreativas",6,,Deporte,"Actividades físicas, deportivas y recreativas",
365,,"Gamificación y lúdica aplicada a las actividades físicas, deportivas y recreativas.",6,,Deporte,"Actividades físicas, deportivas y recreativas",
366,,Tendencias actividad física y deporte,6,,Deporte,"Actividades físicas, deportivas y recreativas",
367,,"Innovación tecnológica aplicada a las actividades físicas, deportivas y recreativas",7,,Deporte,"Actividades físicas, deportivas y recreativas",
368,,Asistencia en servicios de juegos suerte de azar ,2,,Recreación,"Actividades físicas, deportivas y recreativas",
369,,Ejecutor de servicios de juegos suerte de azar ,3,,Recreación,"Actividades físicas, deportivas y recreativas",
370,,Dinamizador de actividades lúdicas y recreativas,4,,Recreación,"Actividades físicas, deportivas y recreativas",
371,,"Auxiliar de servicios de actividad física, recreación y deporte",4,,Recreación,"Actividades físicas, deportivas y recreativas",
372,,Asistencia en parques de atracciones y temáticos,4,,Recreación,"Actividades físicas, deportivas y recreativas",
373,,"Coordinación de servicios de actividades físicas, deportivas y recreativas.",5,,Recreación,"Actividades físicas, deportivas y recreativas",
374,,Supervisión de operación en parques de atracciones y temáticos,5,,Recreación,"Actividades físicas, deportivas y recreativas",
375,,Recreación,6,,Recreación,"Actividades físicas, deportivas y recreativas",
376,,Diseño y gestión de proyectos de ocio y tiempo libre,6,,Recreación,"Actividades físicas, deportivas y recreativas",
377,,"Gestión integral de instalaciones y espacios para las actividades físicas, deportivas y recreativas",6,,Recreación,"Actividades físicas, deportivas y recreativas",
378,,"Gamificación y lúdica aplicada a las actividades físicas, deportivas y recreativas.",6,,Recreación,"Actividades físicas, deportivas y recreativas",
379,,Diseño y desarrollo de actividad física adaptada y recreación inclusiva.,6,,Recreación,"Actividades físicas, deportivas y recreativas",
380,,"Innovación tecnológica aplicada a las actividades  físicas, deportivas y recreativas.",7,,Recreación,"Actividades físicas, deportivas y recreativas",
380,4-ELEA-ELE-001,Montaje y operación de sistemas de generación y almacenamiento de energía eléctrica.,4,"Certificado de aptitud ocupacional de Técnico laboral de Sistemas de generación y
almacenamiento de energía eléctrica",Subsector: electricidad,Electricidad y Electrónica,ELEA
380,4-ELEA-ELE-002,Construcción y mantenimiento de sistemas de transmisión de energía eléctrica.,4,"Certificado de aptitud ocupacional de Técnico laboral en Sistemas de transmisión de
energía eléctrica",Subsector: electricidad,Electricidad y Electrónica,ELEA
380,4-ELEA-ELE-003,"Montaje, operación y mantenimienyo de instlaciones eléctricas y dispositivos de uso final",4,"Certificado de aptitud ocupacional de técnico laboral en sistemas de distribución y
uso final de energía",Subsector: electricidad,Electricidad y Electrónica,ELEA
380,5-ELEA-ELE-004,Supervisión y desarrollo de sistemas de generación y almacenamiento de energía eléctrica,5,Tecnólogo de Sistemas de generación y almacenamiento de energía,Subsector: electricidad,Electricidad y Electrónica,ELEA
380,5-ELEA-ELE-005,Desarrollo de sistemas de transmisión y distribución de energía eléctrica,5,Tecnólogo de Sistemas de transmisión y distribución eléctrica,Subsector: electricidad,Electricidad y Electrónica,ELEA
380,6-ELEA-ELE-006,Gestión y diseño de sistemas de energía eléctrica.,6,Ingeniero Electricista,Subsector: electricidad,Electricidad y Electrónica,ELEA
380,7-ELEA-ELE-007,Dirección de sistemas de generación y almacenamiento de energía eléctrica,7,Magister en Sistemas de generación y almacenamiento de energía eléctrica.,Subsector: electricidad,Electricidad y Electrónica,ELEA
380,7-ELEA-ELE-008,Dirección de sistemas de transmisión y distribución de energía eléctrica.,7,Magister en Sistemas de Transmisión y Distribución de energía,Subsector: electricidad,Electricidad y Electrónica,ELEA
380,4-ELEA-ETO-001 ,MANTENIMIENTO DE EQUIPOS ELECTRÓNICOS DE CÓMPUTO Y DE ENTRETENIMIENTO,4,"Certificado de aptitud ocupacional de técnico laboral en mantenimiento de equipos
electrónicos de cómputo y entretenimiento",Subsedor: electrónica,Electricidad y Electrónica,ELEA
380,4-ELEA-ETO-002 ,"MANTENIMIENTO DE ELECTROGASODOMÉSTICOS DE LÍNEA BLANCA, CLIMATIZACIÓN Y ELECTRODOMÉSTICOS MENORES",4,"Certificado de aptitud ocupacional de técnico laboral en mantenimiento de
electrogasodomésticos de línea blanca, climatización y electrodomésticos menores.",Subsedor: electrónica,Electricidad y Electrónica,ELEA
380,4-ELEA-ETO-003 ,FABRICACIÓN Y ENSAMBLE DE EQUIPOS ELECTRÓNICOS.,4,"Certificado de aptitud ocupacional de técnico laboral en fabricación y ensamble de
equipos electrónicos.",Subsedor: electrónica,Electricidad y Electrónica,ELEA
380,4-ELEA-ETO-004 ,INSTALACIÓN Y OPERACIÓN DE EQUIPOS Y SISTEMAS ELECTRÓNICOS INDUSTRIALES Y DE AUTOMATIZACIÓN.,4,"Certificado de aptitud ocupacional de técnico laboral en instalación y operación de
equipos y sistemas electrónicos industriales y de automatización.",Subsedor: electrónica,Electricidad y Electrónica,ELEA
380,5-ELEA-ETO-005 ,"MANTENIMIENTO DE EQUIPOS, SISTEMAS ELECTRÓNICOS INDUSTRIALES, DE
AUTOMATIZACIÓN O DE REFRIGERACIÓN COMERCIAL.",5,"Tecnólogo en mantenimiento de equipos, sistemas electrónicos industriales, de automatización o de refrigeración comercial.",Subsedor: electrónica,Electricidad y Electrónica,ELEA
380,ELEA-ETO-006 ,MANTENIMIENTO E INSTALACIÓN DE EQUIPO ELECTROMÉDICO.,5,Tecnólogo en mantenimiento e instalación de equipo electromédico,Subsedor: electrónica,Electricidad y Electrónica,ELEA
380,ELEA-ETO-007 ,"SUPERVISIÓN DE LA INSTALACIÓN Y OPERACIÓN DE EQUIPOS, SISTEMAS ELECTRÓNICOS O DE AUTOMATIZACIÓN INDUSTRIAL.",5,"Tecnólogo en supervisión de la instalación y operación de equipos, sistemas electrónicos o de automatización industrial.",Subsedor: electrónica,Electricidad y Electrónica,ELEA
380,ELEA-ETO-008,DISEÑO Y DESARROLLO DE EQUIPOS Y SISTEMAS ELECTRÓNICOS,6,Ingeniero electrónico,Subsedor: electrónica,Electricidad y Electrónica,ELEA
